{
  "registryVersion": "1",
  "app": {
    "slug": "ops-dashboard",
    "name": "Northwind Ops",
    "assistantName": "Ops Assistant"
  },
  "slots": {
    "region": {
      "label": "Region",
      "vocab": [
        { "id": "north", "label": "North campus" },
        { "id": "south", "label": "South campus" },
        { "id": "east", "label": "East wing" },
        { "id": "west", "label": "West wing" },
        { "id": "main", "label": "Main building" }
      ]
    },
    "department": {
      "label": "Department",
      "vocab": [
        { "id": "facilities", "label": "Facilities" },
        { "id": "it", "label": "IT" },
        { "id": "finance", "label": "Finance" },
        { "id": "hr", "label": "HR" },
        { "id": "security", "label": "Security" }
      ]
    },
    "period": {
      "label": "Period",
      "vocab": [
        { "id": "today", "label": "today" },
        { "id": "week", "label": "this week" },
        { "id": "month", "label": "this month" },
        { "id": "quarter", "label": "last quarter" }
      ]
    }
  },
  "intents": [
    {
      "id": "create_ticket",
      "family": "howto",
      "label": "Raise a support ticket",
      "slots": ["department", "region"],
      "keywords": "ticket raise open create new request issue problem broken report fault helpdesk",
      "templates": [
        "how do i raise a ticket",
        "how do i open a support ticket",
        "how can i create a new ticket",
        "where do i report a problem",
        "how do i log an issue with {department}",
        "how do i raise a ticket for {region}",
        "i need to report something broken in {region}",
        "how do i send a request to {department}",
        "what is the way to file a new request",
        "how do i tell {department} about a fault"
      ],
      "paraphrases": [
        "something is broken, who do i tell",
        "i want to log a new issue",
        "how to submit a helpdesk request",
        "the printer is jammed how do i get it fixed",
        "need to open a ticket",
        "where's the form for reporting problems",
        "how do i ask facilities to fix the door",
        "raise a new request please",
        "start a ticket",
        "how do i get someone to look at a fault",
        "the elevator on the third floor is not working, where do i report it",
        "who do i notify that a lamp has gone out in the corridor",
        "log a fault with the security team",
        "record a problem for maintenance",
        "the heating is playing up, how do i flag it",
        "a door is stuck, who should i tell",
        "file a complaint about the broken window",
        "submit an issue to the it desk",
        "how do i notify facilities about a leak",
        "there is a leak in the kitchen, where do i log it",
        "the projector is dead, how do i get it looked at",
        "tell the helpdesk something is wrong",
        "where do i say that something needs fixing",
        "flag a broken light"
      ],
      "answer": {
        "steps": [
          "Open Tickets from the top navigation.",
          "Click New ticket, pick the department and the location, and describe the problem.",
          "You'll get a ticket number; track it from the same list."
        ],
        "links": [
          { "label": "Tickets", "target": { "route": "/tickets" }, "need": "tickets" },
          { "label": "New ticket", "target": { "route": "/tickets/new" }, "need": "tickets" }
        ]
      }
    },
    {
      "id": "find_reports",
      "family": "howto",
      "label": "Find the reports",
      "slots": ["region", "period"],
      "keywords": "reports report analytics numbers chart figures statistics summary export",
      "templates": [
        "how do i find the reports",
        "where are the reports",
        "show me the reports for {region}",
        "how do i see the {period} numbers",
        "where can i look at the figures for {region}",
        "how do i get a summary for {period}",
        "how do i pull up analytics for {region}",
        "where is the {period} report",
        "how can i view charts for {region}",
        "how do i open reporting"
      ],
      "paraphrases": [
        "i need the monthly numbers",
        "where would i look at last month's figures",
        "take me to analytics",
        "how do i see how we're doing",
        "show me some charts",
        "where do the statistics live",
        "i want to look at the report",
        "how do i review the summary",
        "open the reporting page",
        "find the numbers for the east wing",
        "bring up the graphs for facilities",
        "show me the dashboard charts for the west wing",
        "i want to see how many requests we closed this week",
        "where's the analytics section",
        "how are the numbers looking this quarter",
        "show me the trend of requests over time",
        "where do i find the performance summary",
        "how many tickets did we handle last month",
        "give me the statistics for the main building",
        "open the reports view",
        "i need a breakdown of last week",
        "where can i see totals by department",
        "display the monthly figures"
      ],
      "answer": {
        "steps": [
          "Open Reports from the top navigation.",
          "Pick a region and a period in the filter bar; the charts update in place.",
          "Use Export to download the table you're looking at."
        ],
        "links": [
          { "label": "Reports", "target": { "route": "/reports" }, "need": "reports" }
        ]
      }
    },
    {
      "id": "book_room",
      "family": "howto",
      "label": "Book a meeting room",
      "slots": ["region", "period"],
      "keywords": "book booking room meeting reserve reservation space desk calendar schedule",
      "templates": [
        "how do i book a meeting room",
        "how do i reserve a room",
        "how can i book a room in {region}",
        "where do i reserve a space for {period}",
        "how do i find a free room in {region}",
        "how do i schedule a meeting room for {period}",
        "i want to book a desk in {region}",
        "where is the room booking page",
        "how do i reserve a space in {region} for {period}",
        "how do i cancel a room booking"
      ],
      "paraphrases": [
        "need a room for a meeting",
        "reserve a conference room",
        "how do i grab a room for tomorrow",
        "where do i book space",
        "can i reserve a desk",
        "get me a meeting room in the main building",
        "how to book rooms",
        "is there a way to reserve a room",
        "i need somewhere to hold a meeting",
        "book a room this week",
        "grab me a room at 2",
        "reserve the large room for thursday",
        "how do i put a hold on a conference room",
        "book the boardroom for an hour",
        "i need a meeting space on friday morning",
        "reserve somewhere for ten people",
        "hold a room for my team tomorrow",
        "how do i schedule the training room",
        "get me a space at 4pm",
        "book a huddle room this afternoon",
        "where do i reserve the auditorium",
        "put a room on my calendar"
      ],
      "answer": {
        "steps": [
          "Open Rooms from the top navigation.",
          "Choose the building and the time; free rooms are highlighted.",
          "Click a room to reserve it — the booking lands in your calendar."
        ],
        "links": [
          { "label": "Rooms", "target": { "route": "/rooms" }, "need": "rooms" }
        ]
      }
    },
    {
      "id": "manage_users",
      "family": "howto",
      "label": "Add or remove a user",
      "slots": ["department"],
      "keywords": "user users add remove invite account access role permission staff member people team",
      "templates": [
        "how do i add a user",
        "how do i invite someone",
        "how do i remove a user",
        "how do i give someone access",
        "how do i add a new member to {department}",
        "how do i change someone's role",
        "where do i manage accounts",
        "how do i take away access from a user in {department}",
        "how do i see who has access",
        "how do i invite a colleague from {department}"
      ],
      "paraphrases": [
        "add a new person to the system",
        "someone left, how do i remove their account",
        "invite my colleague",
        "where are the user settings",
        "change a person's permissions",
        "how do i onboard a new starter",
        "revoke access for a user",
        "manage the team",
        "give jane admin rights",
        "who can i add to the account",
        "a new starter joins next week, how do i set them up",
        "make sarah an administrator",
        "remove a user from the system",
        "kick someone off the account",
        "how do i deactivate a leaver",
        "promote a user to admin",
        "how do i reset a colleague's access",
        "add tom to the finance team",
        "give a new employee a login",
        "who is an administrator here",
        "take away editing rights from a user",
        "how do i get a contractor into the system",
        "downgrade someone to read only",
        "create an account for the new manager"
      ],
      "answer": {
        "steps": [
          "Open Settings → Users.",
          "Click Invite, enter the email address, and pick a role and department.",
          "To remove someone, open their row and choose Remove access."
        ],
        "links": [
          { "label": "Users", "target": { "route": "/settings/users" }, "need": "admin" }
        ]
      }
    },
    {
      "id": "connect_integrations",
      "family": "howto",
      "label": "Connect another system",
      "slots": [],